{
  "version": 1,
  "projectName": "lebonplan",
  "lastStartAt": "2026-03-04T15:30:00.000Z",
  "lastStopAt": null,
  "resources": {
    "docker-desktop": {
      "type": "app",
      "status": "running",
      "startedByRuntime": true,
      "lastKnownPid": 14448,
      "lastSeenAt": "2026-03-04T15:30:03.000Z"
    },
    "docker-compose": {
      "type": "service",
      "status": "running",
      "startedByRuntime": true,
      "lastKnownPid": 15220,
      "lastSeenAt": "2026-03-04T15:30:10.000Z"
    },
    "frontend": {
      "type": "service",
      "status": "running",
      "startedByRuntime": true,
      "terminalTabName": "frontend",
      "lastSeenAt": "2026-03-04T15:30:15.000Z"
    }
  }
}
